commit	val_bpb	memory_gb	status	description
84a8401	2.122623	21.2	keep	baseline - current config (depth=4, batch=2^16, matrix_lr=0.04)
b770cfb	2.012896	21.4	discard	SwiGLU activation in MLP (replace squared ReLU) - worse
6e7894b	2.224941	23.9	discard	increase depth 4→6 (model_dim 256→384) - fewer steps hurt more than capacity helped
bb04035	1.876559	21.2	keep	device_batch 16→32 (grad_accum 2→1) - more optimizer steps per budget
4926214	1.822685	21.2	keep	reduce warmdown_ratio 0.5→0.3 (more steps at full LR)
0b820f1	1.686443	21.2	keep	halve total_batch 2^16→2^15 (device_batch 32→16) for 2x more optimizer steps
098bc40	1.489485	21.2	keep	halve total_batch 2^14→2^13 (device_batch 8→4) for 2x more optimizer steps
66da87a	1.645814	21.2	discard	halve total_batch 2^13→2^12 (device_batch 4→2) - worse: too small batch
441f7f6	1.530547	21.2	discard	reduce warmdown_ratio 0.3→0.15 - worse
